ObjectID *,Shape *,Type,Title,Issuance Date,Year,Cancellation Date,Cause,Count,Monitoring Station,Location Name,Statewide,Island,Island Wide,County,Advisement,Volume_gallons,Status,Latitude,Longitude
197,Point,Sewage Spill,Wastewater Discharge Kapalama Canal,11/30/2012,2012,1/7/2013,Broken sewer line,<Null>,<Null>,<Null>,No,Oahu,No,Honolulu,"A complaint investigation led to the discovery of a broken sewer line discharging into a storm drain along Kokea Street that empties into Kapalama Canal.  C&C Environmental Services, DOH Clean Water Branch , and Hawaii Housing Authority officials  investigated the discharge  in an underground drainage tunnel and determined that the sewer line belongs to the Hawaii Housing Authority.  Hawaii Housing Authority has contacted a private contractor and will be repairing the line.  The discharge has been stabilized and warning signs have been posted.  Public is advised to stay out of Kapalama Canal until repairs have been completed.  ",,Closed,21.3234,-157.87114
198,Point,Sewage Spill,"Waste Water Spill 1812 Hunnewell Street, OAHU",11/13/2012,2012,11/15/2012,Broken pipe.,<Null>,<Null>,<Null>,No,Oahu,No,Honolulu,"A broken pipe caused a waste water spill at 1812 Hunnewell Street.  C&C crews managed to pump out approximately 3500 gallons, however, an estimated 1275 gallons flowed down the storm drain before crews could arrive.  Warning signs are being posted at the Ala Wai Canal and water samples are being taken.  Public should stay out of the Ala Wai Canal until Warning signs are removed.

",3500,Closed,21.30049,-157.82292
199,Point,Sewage Spill,Waste Water Discharge from Pearl Kai Shopping Center,10/29/2012,2012,11/1/2012,Broken Sewer Line,<Null>,<Null>,<Null>,No,Oahu,No,Honolulu,"A broken sewer line caused a sewer manhole to overflow 2,200 gallons of waste water into a stream west of the Pearl Kai Shopping Center.  C&C workers stopped the discharge and notified Pearl Kai management of the spill and maintained a watch until private contractors arrived.  Warning signs were posted by the Department of Health.  Public is advised to stay out of the stream and the portion of Pearl Harbor from McGrew Point to Blaisdell Park.
",2200,Closed,21.37974,-157.94418
200,Point,Sewage Spill,"Wastewater discharge, Hickam Air Force Base",10/12/2012,2012,10/15/2012,Equipment failure,<Null>,<Null>,<Null>,No,Oahu,No,Honolulu,"***Update** The spill volume has been update to 9000 gallons.The dischage is not expected to reach the harbor waters.***             The public is advised to stay out of the waters at Hickam Beach. CWB was notified by NAVFAC of an estimated 3000 gallon spill along Gardner Avenue, Hickam AFB, due to equipment failure. Approximately 1000 gallons entered into a storm drain which leads to Hickam Beach.  It is unconfirmed if the discharge reached the beach, however as a precaution warning signs have been posted and the public is advised to remain out of the waters until the signs have been removed.",9000,Closed,21.31906,-157.96047
201,Point,Sewage Spill,Sewage Spill - waters between Kawela Bay and Kuilima Cove,8/10/2012,2012,8/14/2012,Broken pipe,<Null>,<Null>,<Null>,No,Oahu,No,Honolulu,"The public is advised as a precaution to stay out of the waters between Kuilima Cove and Kawela Bay due to a sewage spill near the Kuilima Hotel. CWB was notified by Aqua Engineering of a sewage spill that may be up to 28,000 gallons caused by a broken pipe. Up to 20,000 gal may have entered into a storm drain which eventually empties into the ocean, however at this time Aqua Engineering is unsure of actual amounts reaching the ocean.  The flow has been stopped, warning signs have been posted and water samples will be taken. As a precaution, the public is advised to remain out of the area until the warning signs have been removed.",28000,Closed,21.70083,-157.98798
202,Point,Sewage Spill,Waste Water Discharge  1635 Stillman Lane,7/24/2012,2012,7/30/2012,Illegal discharge,<Null>,<Null>,<Null>,No,Oahu,No,Honolulu,"A joint investigation between CWB and CCH-Environmental Services (Collection System Maintenance) found that sewage has been released from 1635 Stillman Lane.  The sewage was released into Waolani Stream, which flows into Nuuanu Stream near the School Street Bridge. 
The Volume released is unknown, though the property has 12 apartments.  The release was stopped this morning, July 24, 2012 around 11:00 am, however, the release has been ongoing for at least 2 weeks.
",,Closed,21.31982,-157.85714
203,Point,Sewage Spill,Waste Water Spill 1500 Ala Moana Blvd,7/21/2012,2012,7/24/2012,Private Contractor Error,<Null>,<Null>,<Null>,No,Oahu,No,Honolulu,Private contractor drilled  into a sewer lateral during construction work at 1500 Ala Moana Blvd.  More than 3000 gallons have entered the Ala Wai Canal.  Situation is on-going. Warning signs are being posted.  ,3000,Closed,21.29167,-157.8453
204,Point,Sewage Spill,Waste Water Discharge 44-018 Aumoana Place,7/10/2012,2012,7/13/2012,Coconut in sewer clean out.  Vandalism,<Null>,<Null>,<Null>,No,Oahu,No,Honolulu,Vandalism caused a waste water discharge from 44-018 Aumoana Place.  Approximately 25 gallons entered into Kaneohe Bay.  The discharge site is near the Kaneohe Yacht Club.  Club management has been notified.  Warning signs  have been posted.  ,25,Closed,21.4188,-157.76527
205,Point,Sewage Spill,Manhole Overflow at 2135 Wilson Street,6/5/2012,2012,6/8/2012,Rags and newspaper in line,<Null>,<Null>,<Null>,No,Oahu,No,Honolulu,Approximately 1225 gallons overflowed form a manhole at 2135 Wilson Street and entered into Kalihi Stream.  Warning signs are being posted and water samples will be collected. Public is advised to stay out of Kalihi Stream from the Likelike Highway Bridge to Keehi Lagoon.  ,1225,Closed,21.34529,-157.86641
206,Point,Sewage Spill,Waste Water spill 155 North Beretania Street,5/1/2012,2012,6/5/2012,Clean out overflow,<Null>,<Null>,<Null>,No,Oahu,No,Honolulu,CWB was notified of a 300 gallons plus waste water spill from a private source at 155 North Beretania Street.  Discharge entered into a storm drain and flowed into Nuuanu Stream.  Nuuanu Stream empties into Honolulu Harbor.  Honolulu Harbor is a non recreational harbor.  Commercial diving operations should not work in the area where Nuuanu Stream enters into Honolulu Harbor for a few days.,300,Closed,21.38214,-157.86095
207,Point,Sewage Spill,"Manhole Overflow  645 Kapahulu Ave, OAHU",3/19/2012,2012,3/19/2012,Grease,<Null>,<Null>,<Null>,No,Oahu,No,Honolulu,"70 gallons of waste water overflowed from a manhole located at 645 Kapahulu Ave, entered into a storm drain that discharges into the Ala Wai Canal.  As a precaution, Warning signs will be posted along the Ala Wai Canal  from the Diamondhead end  to Ala Wai Field opposite Kuamoo Street. Public and canoe paddles are advised to stay out of that portion of the Ala Wai Canal. UPDATE C&C confirms that spill did not reach Ala Wai Canal.",70,Closed,21.27597,-157.81374
208,Point,Sewage Spill,Manhole Overflow Mikiola Drive,3/9/2012,2012,3/13/2012,Heavy Rains,<Null>,<Null>,<Null>,No,Oahu,No,Honolulu,"Heavy rains this morning caused a waste water manhole to overflow at 44-217 Mikiola Drive.  An estimated 2,250 gallons entered into Kaneohe Bay.  Public is reminded that a Brown Water Advisory is still in effect for the entire island of Oahu and should stay out of coastal waters and especially Kaneohe Bay.

",2250,Closed,21.41211,-157.77345
209,Point,Sewage Spill,"Waste Water discharge Wahiawa Reservoir, OAHU",3/7/2012,2012,3/11/2012,Power Outage,<Null>,<Null>,<Null>,No,Oahu,No,Honolulu,"Due to a short power outage, 7000 gallons of partially treated and non disinfected effluent was discharged into Wahiawa Reservoir. Warning signs will be posted. Public (fisherman) are advised to stay out of Wahiawa Reservoir for the next several days until bacteria levels return to normal. ",7000,Closed,21.491801,-158.039226
210,Point,Sewage Spill,"Wastewater discharge, Palolo",3/6/2012,2012,3/9/2012,Heavy rains,<Null>,<Null>,<Null>,No,Oahu,No,Honolulu,"Due to heavy rains, a manhole overflowed at 1556 Pukele Ave, Palolo Valley.  Waste water flowed into Palolo Stream  with the rain.  Situation is ongoing, warning signs are being posted, and water samples will be collected.  Public is reminded that a Brown Water Advisory is in effect for the entire island of Oahu.  Stay of of streams, flooded areas, and coastal areas.  If the water is brown, stay out.",,Closed,21.2912,-157.79987
211,Point,Sewage Spill,"Manhole Overflow 5307 Kalanianaole Hwy, OAHU",3/6/2012,2012,3/13/2012,Heavy Rains,<Null>,<Null>,<Null>,No,Oahu,No,Honolulu,"Due to heavy rains, 2 manholes located at 5307 Kalanianaole Hwy overflowed and discharge entered into ocean.  Situation is ongoing, warning signs are being posted, and water samples to be collected.  Public is reminded that there is a Brown Water Advisory for the entire island of Oahu.  Stay out of streams, flooded areas, and coastal waters around Oahu.  If the water is brown, stay out.  ",,Closed,21.27755,-157.75029
212,Point,Sewage Spill,Manhole overflows at Kaneohe PTF,3/5/2012,2012,3/13/2012,Heavy rains,<Null>,<Null>,<Null>,No,Oahu,No,Honolulu,Heavy rains caused two manholes to overflow at the Kaneohe Waste Water PTF.  Spill is ongoing at a rate of 300 gallons per minute for both manholes.   Discharge is entering into Kawa Stream.  Public is advised to stay out of waters  fronting Mahalani Circle to Kaimalu Place.            UPDATE! 3/9/2012.  Heavy rains and hail caused another manhole overflow at the WWPTF.  Public is reminded that a BWA is still in effect for the entire island of Oahu.        ,,Closed,21.41491,-157.78302
213,Point,Sewage Spill,"Wastewater discharge, Keehi Lagoon",2/19/2012,2012,2/28/2012,Cracked pipe,<Null>,<Null>,<Null>,No,Oahu,No,Honolulu,"The public is advised to stay out of the waters of Keehi Lagoon near the boat ramp areas of Sand Island State park and the adjacent channel due to a wastewater discharge located at the drawbridge section of Sand Island Access Road. The damaged pipe is a force main owned by the U.S. Army. Aqua Engineers, Inc. is handling the repairs. Per information from the company, the discharge has been stopped, water samples have been taken and warning signs have been posted along Keehi Lagoon and the boat ramp area of Sand Island State Park. In addition, a press release from Aqua Engineers has been issued.
 Signs will be posted and the public is advised to remain out of the areas until this warning has been removed.",,Closed,21.33135,-157.8894
214,Point,Sewage Spill,"Wastewater discharge, Mamala Bay",2/19/2012,2012,2/24/2012,Breaker trip,<Null>,<Null>,<Null>,No,Oahu,No,Honolulu,"The public is advised to stay out of the waters of near the Mamala Bay near the entrance of Pearl Harbor near the reef runway. CWB was notified of an estimated 70,000 gal discharge of effluent that had undergone secondary treatment and disinfection, but not sand filtration from the Fort Kamehameha Wastewater Treatment Facility. The bypass was caused by a breaker trip at approixmtely 9:40pm for 45 minutes last night. The outfall is located 1.5 miles from shore, however the public is advised to stay out the area until the advisory has been lifted.",70000,Closed,21.29136,-157.95621
215,Point,Sewage Spill,Waste Water Discharge into Kalihi Stream,1/17/2012,2012,1/20/2012,Grease,<Null>,<Null>,<Null>,No,Oahu,No,Honolulu,A manhole at 2152 N School Street overflowed due to grease blockage.  Approximately 75 gallons entered into a storm drain the empties into Kalihi Stream.  Warning signs to be posted at daybreak.  Public is advised to stay out of Kalihi Stream from the N School Street bridge to the N King Street bridge.,75,Closed,21.33951,-157.87297
216,Point,Sewage Spill,"Wastewater discharge, Nuuanu",12/11/2011,2011,12/15/2011,Heavy rains,<Null>,<Null>,<Null>,No,Oahu,No,Honolulu,"The public is advised to stay out of Waiolani Stream from 65 Ahi Place to Vineyard Blvd. CWB was notified of an approximately 500 gal spill fronting 65 Ahi Place. The discharge entered into a nearby stormdrain which empties into Waiolani Stream. The flow has been stopped, sampling will be undertaken, and signs have been posted along affected areas. Teh public is advised to remain out of the stream until signs have been removed.",500,Closed,21.33548,-157.84256
217,Point,Sewage Spill,Waste Water Spill Force Main Kailua WWTF CORRECTION!,7/31/2011,2011,9/8/2011,Break in Force Main,<Null>,<Null>,<Null>,No,Oahu,No,Honolulu,"20,000 gal waste water spill from a force main occurred at entrance to Kailua WWTF.  Discharge entered into a storm drain that discharges into adjacent marsh area and into Nuupia Pond.  Discharge did not enter into Kaneohe Bay.  An earlier notificatioin was in error, we apologize for any incovenience.",20000,Closed,21.42728,-157.7522
218,Point,Sewage Spill,Waste Water Discharge Ala Wai Canal,7/14/2011,2011,7/15/2011,Grease in Line,<Null>,<Null>,<Null>,No,Oahu,No,Honolulu,An overflow from a clean-out located at 1830 Kapiolani Blvd resulted in a 75 gallon discharge into a canal that empties into Ala Wai Canal.  Warning signs will be posted.  ,75,Closed,21.29084,-157.83405
219,Point,Sewage Spill,Waste Water Discharge into Nuuanu Stream,7/13/2011,2011,7/18/2011,Grease in 6 inch line,<Null>,<Null>,<Null>,No,Oahu,No,Honolulu,Grease blockage in a 6 inch line caused a 350 gallon  manhole overflow at 1629 Waikahululu Lane.  Flow entered into a storm drain that empties into Nuuanu Stream mauka of Foster Botanical Garden.  Public is advised to stay out of Nuuanu Stream from School Street to Honolulu Harbor.  Warning signs will be posted and water samples collected.,350,Closed,21.31833,-157.85649
220,Point,Sewage Spill,"Wastewater discharge, Mikiola Dr.",6/5/2011,2011,6/14/2011,Heavy rains,<Null>,<Null>,<Null>,No,Oahu,No,Honolulu,"CWB was notified by City Env Svcs of a spill of approximately 1000 gals from cleanouts at 44-217 Mikiola Drive. Due to proximity to Kaneohe bay and the heavy runoff at the time, it is assumed the discharge entered the bay. The flow has been stopped and posting of signs and water sampling has been initiated.  Kaneohe bay is currently under a BWA and an advisory for a sewage discharge at Kawa stream.",1000,Closed,21.41211,-157.77345
221,Point,Sewage Spill,"Wastewater discharge, Kaneohe Bay Dr.",6/5/2011,2011,6/14/2011,Heavy rains,<Null>,<Null>,<Null>,No,Oahu,No,Honolulu,"CWB was notified by City Env Svcs of a spill of approximately 150 gals from a manhole fronting 45-035 Kaneohe Bay Drive. Due to proximity to Kaneohe bay and the heavy runoff at the time, it is assumed the discharge entered the bay. The flow has been stopped and posting of signs and water sampling has been initiated.  Kaneohe bay is currently under a BWA and an advisory for a sewage discharge at Kawa stream.",150,Closed,21.41113,-157.7792
222,Point,Sewage Spill,"Wastewater discharge, Pearl Harbor",4/3/2011,2011,4/5/2011,Failed seal,<Null>,<Null>,<Null>,No,Oahu,No,Honolulu,"The public is advised to stay out of the areas of Pearl Harbor between Piers Sierra 8 and 9 near the submarine base, due to a wastewater discharge at the area.  CWB was notified of an approximately 70 gal wastewater discharge that entered into the harbor.  The area is restricted to the general public, however signs will be posted in the immediate area.",70,Closed,21.35302,-157.94077
223,Point,Sewage Spill,Manhole Overflow at 124 Olomana Lane,3/31/2011,2011,4/1/2011,Grease and rags blocking sewer line,<Null>,<Null>,<Null>,No,Oahu,No,Honolulu,"A sewer manhole overflowed at 124 Olomana Lane due to grease and rags blocking a 6 inch sewer line.  About 1,360 gallons of untreated wastewater entered into Pauoa Stream, feeds into Nuuanu Stream, goes through Lilioukalani Gardens and empties into Honolulu Harbor. ",1360,Closed,21.31861,-157.84968
224,Point,Sewage Spill,"200 gallons waste water enters into Sierra Pier 1, Pearl Harbor, Oahu",3/21/2011,2011,3/23/2011,Operator error,<Null>,<Null>,<Null>,No,Oahu,No,Honolulu,During unloading of waste water from a submarine an accident occurred that blew off the sewer manhole cover and resulted in a 300 gallon spill.  About 100 gallons was captured but 200 gallons flowed into the waters fronting Sierra Pier 1.  Warning signs have been posted.  Military and private commercial diving activities around Sierra Pier 1 should be postphoned for a few days.,300,Closed,21.35302,-157.94077
225,Point,Sewage Spill,"Wastewater discharge, Pearl City",2/4/2011,2011,2/16/2011,Force main break,<Null>,<Null>,<Null>,No,Oahu,No,Honolulu,"UPDATE: The flow to the canal and Middle Loch has resumed due to failure of the emergency line. The public is advised to stay out of the canal along the Pearl Harbor bike path and the areas in Middle Loch near the mouth of the canal. Commercial dive operations in Middle Loch near the affected area should be postponed. CWB was notified of a wastewater discharge due to a force main break along the Pearl Harbor bike path, south of Waiawa Road, approximately 800 meters west of Lehua Ave.  Preliminary estimates are at tens of thousands of gals. Signs have been posted.",,Closed,21.38739,-157.98535
226,Point,Sewage Spill,"Waste Water Discharge into Kapalama Canal, OAHU",1/24/2011,2011,1/28/2011,Grease build up in line.,<Null>,<Null>,<Null>,No,Oahu,No,Honolulu,"A grease build up in the sewer line at 1622 Ahiahi Place resulted in a sewage leak at a pipe joint.  10,250 gallons flowed into a storm drain that empties into Kapalama Canal and eventually goes to Honolulu Harbor.  Public is advised to stay out of Kapalama Canal and commercial dive operations  should be postponed in waters of Honolulu Harbor from Piers 37-39.  ",10250,Closed,21.32841,-157.86269
227,Point,Sewage Spill,"Waste Water Overflow Kaneohe PTF, OAHU",1/13/2011,2011,1/18/2011,Heavy rains,<Null>,<Null>,<Null>,No,Oahu,No,Honolulu,"Heavy rains overnight caused a sewer manhole to overflow at the Kaneohe Pre-Treatment Facility.  Approximately, 3000 gallons flowed into Kawa Stream and then into Kaneohe Bay.  Public is advised to stay out of stormwater runoff, flood waters, and coastal waters.  A Brown Water Advisory has been issued for Oahu.",3000,Closed,21.41491,-157.78302
228,Point,Sewage Spill,"Waste Water Overflow Lihue Street, OAHU",1/13/2011,2011,1/20/2011,Heavy rains,<Null>,<Null>,<Null>,No,Oahu,No,Honolulu,"Heavy rains caused a sewer manhole to overflow at 85-751 Lihue Street in Waianae.  27,700 gallons flowed into Kaupuni Stream and discharged into Pokai Bay.  Public is advised to stay out of stormwater runoff, flood waters, and coastal waters.  A Brown Water Advisory has been issued for Oahu",27700,Closed,21.44867,-158.18788
229,Point,Sewage Spill,"Waste Water Overflow Piikea Street, OAHU",1/13/2011,2011,1/18/2011,Heavy rains,<Null>,<Null>,<Null>,No,Oahu,No,Honolulu,"Heavy rains caused a sewer manhole to overflow at 1718 Piikea Street, Foster Village.    Approximately 3,975 gallons flowed into Halawa Stream and discharged into East Loch, Pearl Harbor.  Public is advised to stay out of stormwater runoff, flood waters, and coastal waters.  A Brown Water Advisory has been issued for Oahu",3975,Closed,21.36757,-157.91554
230,Point,Sewage Spill,"Waste Water Overflow Waianae, OAHU",1/12/2011,2011,1/20/2011,Heavy rains,<Null>,<Null>,<Null>,No,Oahu,No,Honolulu,"A sewer manhole at 87-154 Maipalaoa Road is overflowing and entering into Maili Stream.  Flow is ongoing.  Other sewer manholes in Waianae and other area of Oahu may be overflowing but difficult to see due to heavy rains and flooding.  A Brown Water Advisory has also been issued for the island of Oahu.  The public is advised to stay out of all storm water runoff, flooded areas, and coastal waters.",,Closed,21.40842,-158.1755
231,Point,Sewage Spill,"Wastewater discharge, Kalihi",1/8/2011,2011,1/11/2011,Grease clogged line,<Null>,<Null>,<Null>,No,Oahu,No,Honolulu,"The public is advised to stay out of Kalihi Stream from below 1457 Ahonui Street to the immediate area surrounding the mouth of the stream at Keehi Lagoon.  CWB has been notified by City ENV of a wastewater discharge due to a grease clogged line, from a manhole fronting 1457 Ahohui Street. Approximately 1175 gals entered into a storm drain which leads to Kalihi Stream. Although the spill is not a City line, the City crews have posted warning signs along affected areas.
",1175,Closed,21.33891,-157.87693
232,Point,Sewage Spill,"Discharge Undisinfected Secondary Treated Effluent, Pearl Harbor Channel, OAHU ",1/4/2011,2011,1/6/2011,Loss of Power at Fort Kam WWTP.,<Null>,<Null>,<Null>,No,Oahu,No,Honolulu,"A loss of power resulted in a 110,000 gallon discharge of undisinfected secondary effluent from the Fort Kam WWTP at Hickam AF Base, Oahu.  the effluent was discharge through the Fort Kam outfall near the entrance channel to Pearl Harbor just off the ewa end of the Reef Runway.  ",110000,Closed,21.306979,-157.956671
233,Point,Sewage Spill,"Waste Water Discharge Kaneohe Stream, OAHU",12/24/2010,2010,12/27/2010,Heavy Rains,<Null>,<Null>,<Null>,No,Oahu,No,Honolulu,"Due to heavy rains, a sewer manhole located at the Kaneohe Pre-Treatment Plant overflowed and discharged into Kaneohe Stream.  The amount of discharge is estimated at over 1000 gallons.  Warning signs have been posted due to a previous spill discharging in this area.  The public is advised to stay out of waters fronting Kaneohe Beach Park and Waikalua Pond.",1000,Closed,21.41491,-157.78302
234,Point,Sewage Spill,"Wastewater discharge, Kaneohe",12/23/2010,2010,12/27/2010,Clogged line,<Null>,<Null>,<Null>,No,Oahu,No,Honolulu,"The public is advised to stay out of Kamooalii Stream between 45-521 Apiki Street and Kaneohe Beach Park, and the waters of Kaneohe Beach Park at the mouth of the stream.  CWB was notified of a wastewaterl discharge from a manhole fronting 45-521 Apiki Street.  Approximately 435 gals entered into a storm drain that leads to Kamooalii Stream.  Warning signs have been posted and sampling will be performed.",435,Closed,21.39483,-157.80223
235,Point,Sewage Spill,"Waste Water Discharge Kapalama Canal from 1015 N School Street, Oahu",12/19/2010,2010,12/22/2010,Sewer Manhole overflow due to heavy rains.,<Null>,<Null>,<Null>,No,Oahu,No,Honolulu,"Sewer Manhole overflow near 1015 N. School Street due to heavy rains.  Situation ongoing, over 1000 gallons entered into storm drain that empties into Kapalama Canal and then into Honolulu Harbor.  Brown Water Advisory in effect for Oahu.  ",1000,Closed,21.32769,-157.86431
236,Point,Sewage Spill,-155.08864,12/19/2010,2010,12/22/2010,Heavy rains.,<Null>,<Null>,<Null>,No,Oahu,No,Honolulu,Heavy rains caused a sewer manhole to overflow at the Kailua WWTP.  Discharge entered into marshy area north of the plant.,,Closed,21.42728,-157.7522
237,Point,Sewage Spill,"Waste Water Discharge into Kaelepulu Stream, OAHU.",12/19/2010,2010,12/22/2010,Heavy rains.,<Null>,<Null>,<Null>,No,Oahu,No,Honolulu,Heavy rains caused a sewer manhole to overflow at Kakahiaka and Wanaao Road.  Overflow entered into Kaelepulu Stream.,,Closed,21.3911,-157.73101
238,Point,Sewage Spill,"Partially Treated Sewage Bypass, Fort Kam Outfall, OAHU.",12/19/2010,2010,12/22/2010,Heavy Rains.,<Null>,<Null>,<Null>,No,Oahu,No,Honolulu,"Heavy rains resulted in a bypass of 13,000 gallons of undisineffected secondary effluent from the Fort Kam WWTP outfall near the western end of the Reef Runway.  ",13000,Closed,21.306979,-157.956671
239,Point,Sewage Spill,"Waste Water Discharge into Palolo Stream near 1521 8th Ave, OAHU",12/19/2010,2010,12/23/2010,Heavy rains.,<Null>,<Null>,<Null>,No,Oahu,No,Honolulu,Heavy rains caused a sewer manhole to overflow at 1521 8th Avenue.  Volume is less than a 1000 gallons.,1000,Closed,21.29022,-157.80028
240,Point,Sewage Spill,"Waste Water Spill Palolo Stream, OAHU",12/19/2010,2010,12/23/2010,Sewer pipe failure.,<Null>,<Null>,<Null>,No,Oahu,No,Honolulu,"A sewer pipe failure has resulted in a waste water discharge into Palolo Stream near 2010 9th Avenue.  Approximately 4000 gallons has entered into the stream,  situation is ongoing,  and C&C crews are on scene conducting repairs.  ",4000,Closed,21.29978,-157.7948
241,Point,Sewage Spill,"Waste Water Discharge Hawaii Kai Marina, OAHU.",12/19/2010,2010,12/23/2010,Power failure and standby generator problems.,<Null>,<Null>,<Null>,No,Oahu,No,Honolulu,"A power  failure and standby generator problems resulted in a  waste water bypass of 85,000  gallons into the Hawaii Kai Marina from pump station located at Lunalilo Home Road and Hawaii Kai Drive.  ",85000,Closed,21.29614,-157.68904
242,Point,Sewage Spill,Wastes Water Discharge from Manhole at Kaneohe PTF,12/19/2010,2010,12/22/2010,Heavy rains.,<Null>,<Null>,<Null>,No,Oahu,No,Honolulu,Sewage manhole overflowed due to  heavy rains at  the Kaneohe Wastewater Pre-Treatment Facility.  Over 1000 gallons entered into adjacent Kaneohe Stream and into Kaneohe Bay.  A Brown Water Advisory is in effect for the island of Oahu.  Public is advised to stay out of all coastal waters impacted by storm water runoff.  ,1000,Closed,21.41491,-157.78302
243,Point,Sewage Spill,"Waste Water Discharge into Honolulu, Harbor, OAHU",12/19/2010,2010,12/22/2010,Heavy rains,<Null>,<Null>,<Null>,No,Oahu,No,Honolulu,A sewer manhole overflowed due to heavy rains at the intersection of Sumner and Pine Street.  More than 1000 gallons entered into Honolulu Harbor.  ,1000,Closed,21.31708,-157.86838
